<?xml version="1.0" encoding="UTF-8"?>
<!DOCTYPE racine SYSTEM "recette.dtd">

<recette>
	<nom>Oeufs a la coque</nom>
	<portion>4</portion>
	<preparation value="1" unit="min"/>
	&cuisson;
	<ingredients>
		<i>
			<nom id="ing1">oeufs</nom>
			<nbre>4</nbre>
		</i>
	</ingredients>
	<guide>
Plongez delicatement les &renvoi; dans de l'eau portee a ebullition. Faites reprendre l'ebullition, puis baissez le feu et laissez cuire a petits bouillons pendant
&cuisson; minutes. Egouttez les &renvoi;, posez-les dans des coquetiers et coupez horizontalement la partie superieure pour les deguster. 
</guide>
</recette>